{
  "$schema": "https://json-schema.org/draft/2020-12/schema",
  "$id": "https://schemas.ardyn.ai/boundary-maps/ardyn.phase-5.9.approval-evaluator-grant-boundary-contract.schema.json",
  "title": "ARDYN Boundary Map: ardyn.phase-5.9.approval-evaluator-grant-boundary-contract",
  "description": "Auto-generated JSON Schema for boundary-map artifact validation. Enforces shape + safety invariants.",
  "type": "object",
  "required": [
    "schema",
    "schemaVersion",
    "phase",
    "artifactKind",
    "metadataGeneratedAt",
    "sourcePhase",
    "contractSummary",
    "boundarySignals",
    "evaluatorGrantBoundaryShape",
    "boundaryCases",
    "validationRules",
    "blockedRuntimeEffect",
    "serveRuntimeBlockedBehavior",
    "forbiddenBehavior",
    "filesAllowedToChange",
    "filesForbiddenToChange",
    "validationCommands"
  ],
  "properties": {
    "schema": {
      "type": "string",
      "const": "ardyn.phase-5.9.approval-evaluator-grant-boundary-contract"
    },
    "schemaVersion": {
      "type": "string"
    },
    "phase": {
      "type": "string"
    },
    "artifactKind": {
      "type": "string"
    },
    "metadataGeneratedAt": {
      "type": "string"
    },
    "sourcePhase": {
      "type": "object"
    },
    "contractSummary": {
      "type": "object"
    },
    "boundarySignals": {
      "type": "object"
    },
    "evaluatorGrantBoundaryShape": {
      "type": "object"
    },
    "boundaryCases": {
      "type": "array"
    },
    "validationRules": {
      "type": "object"
    },
    "blockedRuntimeEffect": {
      "type": "object"
    },
    "serveRuntimeBlockedBehavior": {
      "type": "object"
    },
    "forbiddenBehavior": {
      "type": "array"
    },
    "filesAllowedToChange": {
      "type": "array"
    },
    "filesForbiddenToChange": {
      "type": "array"
    },
    "validationCommands": {
      "type": "array"
    }
  },
  "additionalProperties": true
}
